### ISSUE TITLE
ESP does not respond on network when MQTT used without HA API, and "climate: thermostat" used

### ISSUE THREAD

**Issue by Nuetron06** [esphome/issues#4393]
### The problem

MQTT and "platform: thermostat" are incompatible, yet no errors are generated. ESP fails to respond on network, even though it is connected. In addition, the esp32 has to be re-flashed with corrected code through USB to bring back online.

I now know the cause, but it would have been nice to get an error preventing me from using the thermostat platform if it required the HA API. 

### Which version of ESPHome has the issue?

2023.3.2

### What type of installation are you using?

Home Assistant Add-on

### Which version of Home Assistant has the issue?

2023.4.0

### What platform are you using?

ESP32

### Board

LilyGo quad relay board

### Component causing the issue

MQTT and "climate: thermostat"

### Example non-working YAML snippet attempting to use MQTT

```
esphome:
  name: hvac-mqtt
  friendly_name: hvac-mqtt

esp32:
  board: esp32dev
  framework:
    type: arduino

# Enable logging
logger:

# Enable Home Assistant API
#api:
#  encryption:
#    key: *redacted*

mqtt:
  broker: !secret mqtt_server
  username: !secret mqtt_username
  password: !secret mqtt_password
  
ota:
  password: *redacted*

wifi:
  ssid: !secret wifi_ssid
  password: !secret wifi_password
  manual_ip:
    static_ip: 192.168.44.105
    gateway: 192.168.44.1
    subnet: 255.255.255.0
    dns1: *redacted*

  # Enable fallback hotspot (captive portal) in case wifi connection fails
  ap:
    ssid: "Hvac-Mqtt"
    password: *redacted*

captive_portal:
```
```
### Other code here (Sensors, Switches, etc) which are exactly the same between working / non working ###
```
Here's the section I have to remove to get the device to actually check in with the mqtt server (simplified to just one thermostat instead of six):
```
climate:
  - platform: thermostat
    name: "Whole House"
    sensor: house_temp_average
    min_cooling_off_time: 300s
    min_cooling_run_time: 300s
    min_heating_off_time: 300s
    min_heating_run_time: 300s
    min_idle_time: 300s
    cool_action:
      - switch.turn_on: esp_hvac_cooling_house
    heat_action:
      - switch.turn_on: esp_hvac_heating_house
    idle_action:
      - switch.turn_off: esp_hvac_cooling_house
      - switch.turn_off: esp_hvac_heating_house
    preset:
      - name: Away
        default_target_temperature_low: 66 °F
        default_target_temperature_high: 78 °F

```

### Anything in the logs that might be useful for us?

Logs through USB show device attempting to connect to MQTT server, but reports connection failed and tries again.
No mqtt messages:
```
INFO Reading configuration /config/esphome/hvac-mqtt.yaml...
INFO Starting log output from hvac-mqtt/debug
INFO Connected to MQTT broker!
[22:12:16][I][mqtt:216]: MQTT Connected!
```
USB Logs
```
[I][wifi:257]: WiFi Connecting to 'HA'...
[I][wifi:518]: WiFi Connected!
[C][wifi:362]:   Local MAC: 08:3A:F2:B5:84:3C
[C][wifi:363]:   SSID: [redacted]
[C][wifi:364]:   IP Address: 192.168.44.105
[C][wifi:366]:   BSSID: [redacted]
[C][wifi:367]:   Hostname: 'hvac-mqtt'
[C][wifi:369]:   Signal strength: -51 dB ▂▄▆█
[C][wifi:373]:   Channel: 6
[C][wifi:374]:   Subnet: 255.255.255.0
[C][wifi:375]:   Gateway: 192.168.44.1
[C][wifi:376]:   DNS1: 172.24.0.250
[C][wifi:377]:   DNS2: 0.0.0.0
[D][wifi:527]: Disabling AP...
[C][ota:093]: Over-The-Air Updates:
[C][ota:094]:   Address: 192.168.44.105:3232
[C][ota:097]:   Using Password.
[C][mqtt:029]: Setting up MQTT...
[I][mqtt:176]: Connecting to MQTT...
```
After a while, this is in the USB logs:
```
[W][mqtt:264]: MQTT Disconnected: TCP disconnected.
[I][mqtt:176]: Connecting to MQTT...
```
Here's a packet capture from my pfsense firewall:
```
22:18:47.062521 ARP, Request who-has 192.168.44.1 tell 192.168.44.105, length 42
22:18:47.062535 ARP, Reply 192.168.44.1 is-at b4:fb:e4:26:f1:00, length 28
22:18:48.076774 ARP, Request who-has 192.168.44.1 tell 192.168.44.105, length 42
22:18:48.076779 ARP, Reply 192.168.44.1 is-at b4:fb:e4:26:f1:00, length 28
22:18:49.100835 ARP, Request who-has 192.168.44.1 tell 192.168.44.105, length 42
22:18:49.100844 ARP, Reply 192.168.44.1 is-at b4:fb:e4:26:f1:00, length 28
22:18:50.377462 ARP, Request who-has 192.168.44.1 tell 192.168.44.105, length 42
22:18:50.377472 ARP, Reply 192.168.44.1 is-at b4:fb:e4:26:f1:00, length 28
22:18:51.063468 ARP, Request who-has 192.168.44.1 tell 192.168.44.105, length 42
22:18:51.063474 ARP, Reply 192.168.44.1 is-at b4:fb:e4:26:f1:00, length 28
22:18:52.070446 ARP, Request who-has 192.168.44.1 tell 192.168.44.105, length 42
22:18:52.070451 ARP, Reply 192.168.44.1 is-at b4:fb:e4:26:f1:00, length 28
22:18:53.094376 ARP, Request who-has 192.168.44.1 tell 192.168.44.105, length 42
22:18:53.094383 ARP, Reply 192.168.44.1 is-at b4:fb:e4:26:f1:00, length 28
22:18:54.062353 ARP, Request who-has 192.168.44.1 tell 192.168.44.105, length 42
22:18:54.062361 ARP, Reply 192.168.44.1 is-at b4:fb:e4:26:f1:00, length 28
22:18:55.383201 ARP, Request who-has 192.168.44.1 tell 192.168.44.105, length 42
22:18:55.383210 ARP, Reply 192.168.44.1 is-at b4:fb:e4:26:f1:00, length 28
22:18:56.064003 ARP, Request who-has 192.168.44.1 tell 192.168.44.105, length 42
22:18:56.064009 ARP, Reply 192.168.44.1 is-at b4:fb:e4:26:f1:00, length 28
22:18:57.087916 ARP, Request who-has 192.168.44.1 tell 192.168.44.105, length 42
22:18:57.087926 ARP, Reply 192.168.44.1 is-at b4:fb:e4:26:f1:00, length 28
22:18:58.110452 ARP, Request who-has 192.168.44.1 tell 192.168.44.105, length 42
22:18:58.110462 ARP, Reply 192.168.44.1 is-at b4:fb:e4:26:f1:00, length 28
22:18:59.067529 ARP, Request who-has 192.168.44.1 tell 192.168.44.105, length 42
22:18:59.067537 ARP, Reply 192.168.44.1 is-at b4:fb:e4:26:f1:00, length 28
```

### Additional information

Backstory and troubleshooting:
I was in the process of moving my air conditioner controller from the HA API to MQTT due to network issues (disconnects etc, bad wifi coverage). 
However, when I updated the code from HA API to MQTT, I failed to update the climate platform from thermostat to mqtt.
The firmware compiled, downloaded and the debugger attempted to retrieve data from the MQTT server, but no data was coming through. 
Pinging the IP address of the esp received no response. Ubiquiti Unifi console showed the device connected to wifi, IP address correct, mac was correct, and it had a rock-solid link. Packet capture on PfSense showed the device was sending ARP requests (once per second) for the default gateway (the device is on a different subnet than HA), but would not respond to ping or OTA updates.
After testing removing bits of my code, I had narrowed it down to the actual thermostats (there are 6 of them, all to control one air conditioner...).
None of these thermostats have MQTT options yet, but I just wanted to get started pulling the temps through MQTT and go from there. 

Now, if I remove the thermostats, this is what I see in the USB logs:
```
[I][wifi:257]: WiFi Connecting to 'HA'...
[D][sensor:127]: 'House Temperature Average': Sending state nan °C with 1 decimals of accuracy
[I][wifi:518]: WiFi Connected!
[C][wifi:362]:   Local MAC: 08:3A:F2:B5:84:3C
[C][wifi:363]:   SSID: [redacted]
[C][wifi:364]:   IP Address: 192.168.44.105
[C][wifi:366]:   BSSID: [redacted]
[C][wifi:367]:   Hostname: 'hvac-mqtt'
[C][wifi:369]:   Signal strength: -51 dB ▂▄▆█
[C][wifi:373]:   Channel: 6
[C][wifi:374]:   Subnet: 255.255.255.0
[C][wifi:375]:   Gateway: 192.168.44.1
[C][wifi:376]:   DNS1: 172.24.0.250
[C][wifi:377]:   DNS2: 0.0.0.0
[D][wifi:527]: Disabling AP...
[C][ota:093]: Over-The-Air Updates:
[C][ota:094]:   Address: 192.168.44.105:3232
[C][ota:097]:   Using Password.
[C][mqtt:029]: Setting up MQTT...
[I][mqtt:176]: Connecting to MQTT...
[I][mqtt:216]: MQTT Connected!
[I][app:062]: setup() finished successfully!
```
... and this is what I see on the pfsense packet capture:
```
22:27:51.825116 IP 192.168.44.105.62436 > 172.24.0.250.1883: tcp 59
22:27:51.825584 IP 172.24.0.250.1883 > 192.168.44.105.62436: tcp 0
22:28:03.126468 IP 172.24.0.250.1883 > 192.168.44.105.62435: tcp 209
22:28:03.372352 ARP, Request who-has 192.168.44.105 tell 192.168.44.105, length 42
22:28:03.383941 IP 192.168.44.105.62435 > 172.24.0.250.1883: tcp 0
22:28:03.880342 IP 192.168.44.105.62436 > 172.24.0.250.1883: tcp 59
22:28:03.880712 IP 172.24.0.250.1883 > 192.168.44.105.62436: tcp 0
```

The only thing I changed was removing the thermostats from the code.

**Comment by ssieb** [comment]
You didn't include any yaml or any logs.  There's no reason that the thermostat component would interfere with mqtt.  You said it already had bad wifi coverage, how is changing from the API to mqtt going to help that?  If the device keeps sending arp requests then it's not getting a response.  You need to check your network config.

**Comment by Nuetron06** [comment]
Sorry, was at work and couldn't post error logs because I didn't have physical access to the device. I'll be updating the original post shortly. 
The thing is, network config is the same, but if I take out the thermostats from the code, it is able to connect (I've verified through mqtt explorer). Packet capture on the router shows arp requests only, and incoming icmp packets but no outgoing data.

**Comment by Nuetron06** [comment]
> You said it already had bad wifi coverage, how is changing from the API to mqtt going to help that?
I should have taken screenshots of the Unifi wifi experience console. I think the "bad coverage" was needing to re-flash the device via USB. Since I did that, I have not had a single disconnect in over 24 hours. Before, the device was reconnecting to wifi every 30s to 6m. 
The main difference I was shooting for with the api>mqtt change is that the esp could check in when it could, whereas with the api, I'd have to let HA check in, and it was hit or miss (It's like trying to shoot a fan blade through a hole when you can't see the fan blade coming).
However, since re-flashing, I have not had any more disconnects through the API. It had been progressively getting worse.

**Comment by Nuetron06** [comment]
Logs are added now.

>There's no reason that the thermostat component would interfere with mqtt.
>If the device keeps sending arp requests then it's not getting a response. 

My thoughts too. 

>You need to check your network config.

Done. I'm a network engineer, and because I do often overlook stuff, I don't reach out to report bugs lightly because of it. 
I've been able to reproduce on another device, and it's not the network config, since it works without the thermostats.
